{
  "spec_version": "agenomic/v0.3",
  "run_id": "run_01",
  "agent": {
    "agent_id": "agent://acme/claims",
    "agent_version": "1.0.0",
    "genome_version": "sha256:aaaaaaaaaaaaaaaaaaaaaaaaaaaaaaaaaaaaaaaaaaaaaaaaaaaaaaaaaaaaaaaa",
    "runtime": {
      "name": "node",
      "version": "22.0.0",
      "adapter_version": "0.3.0"
    }
  },
  "llm": {
    "provider": "openai",
    "model": "gpt-x",
    "model_version": "2026-06-01",
    "temperature": 0.2,
    "top_p": 1,
    "seed": 42
  },
  "components": {
    "prompt_version": "sha256:bbbbbbbbbbbbbbbbbbbbbbbbbbbbbbbbbbbbbbbbbbbbbbbbbbbbbbbbbbbbbbbb",
    "policy_version": "sha256:cccccccccccccccccccccccccccccccccccccccccccccccccccccccccccccccc",
    "memory_version": "sha256:dddddddddddddddddddddddddddddddddddddddddddddddddddddddddddddddd",
    "knowledge_version": "sha256:eeeeeeeeeeeeeeeeeeeeeeeeeeeeeeeeeeeeeeeeeeeeeeeeeeeeeeeeeeeeeeee",
    "tool_versions": {
      "search": "sha256:ffffffffffffffffffffffffffffffffffffffffffffffffffffffffffffffff"
    }
  },
  "input": {
    "hash": "sha256:1111111111111111111111111111111111111111111111111111111111111111",
    "redacted_payload": {
      "text": "[redacted]"
    },
    "classification": [
      "internal"
    ]
  },
  "output": {
    "hash": "sha256:2222222222222222222222222222222222222222222222222222222222222222",
    "redacted_payload": {
      "answer": "approved"
    },
    "classification": [
      "internal"
    ],
    "semantic_signature": "sig://semantic/1"
  },
  "events": [
    {
      "event_id": "evt_01",
      "type": "run.started",
      "timestamp": "2026-06-22T00:00:00Z",
      "actor": {
        "kind": "agent",
        "id": "agent://acme/claims"
      },
      "payload_hash": "0000000000000000000000000000000000000000000000000000000000000000",
      "prev_event_hash": "0000000000000000000000000000000000000000000000000000000000000000",
      "side_inputs": {
        "captured": false
      },
      "event_hash": "0d8b4da4b1ff1b394f8a442071817afed14eff5fb7c398add0db6abefb0fb1c1"
    }
  ],
  "execution_graph": {
    "nodes": [
      {
        "id": "evt_01",
        "kind": "event"
      }
    ],
    "edges": []
  },
  "risk_scores": [],
  "compliance_checks": [],
  "alignment_checks": [],
  "environment_snapshot": {
    "os": "linux"
  },
  "integrity": {
    "run_merkle_root": "0e52025549de17f220b6b8218182fe5d7b489df85773bf416f2ac8201ac1f14d",
    "signed_by": "key://org/acme",
    "signature": "ed25519:example"
  }
}